{
  "snapshot_id": "snapshot_019f0000-0000-7000-8000-000000000201",
  "protocol_version": { "major": 1, "minor": 0 },
  "captured_at": { "wall_time": "2026-07-12T00:02:01Z", "monotonic_offset_ns": 201000000 },
  "runtime_context": {
    "project_id": "project_019f0000-0000-7000-8000-000000000001",
    "application_id": "dev.vistrea.demo",
    "build_id": "build_019f0000-0000-7000-8000-000000000001",
    "application_version": "1.0.0",
    "platform": "ios",
    "device": {
      "kind": "simulator",
      "model": "Demo iPhone",
      "os_version": "18.0",
      "extensions": {}
    },
    "environment_id": "local",
    "locale": "en-US",
    "theme": "light",
    "text_scale": 1,
    "sdk_version": "0.1.0",
    "adapter_versions": { "uikit": "0.1.0" },
    "extensions": {}
  },
  "display": {
    "coordinate_unit": "logical_point",
    "origin": "top_left",
    "logical_size": { "width": 390, "height": 844 },
    "pixel_size": { "width": 1170, "height": 2532 },
    "pixel_scale_x": 3,
    "pixel_scale_y": 3,
    "orientation": "portrait",
    "safe_area": { "top": 59, "left": 0, "bottom": 34, "right": 0 },
    "geometry_revision": "display-1",
    "extensions": {}
  },
  "trees": [
    {
      "tree_id": "tree_019f0000-0000-7000-8000-000000000201",
      "kind": "semantic",
      "root_node_ids": ["node_019f0000-0000-7000-8000-000000000201"],
      "payload": {
        "inline_nodes": [
          {
            "node_id": "node_019f0000-0000-7000-8000-000000000201",
            "child_ids": [],
            "native_type": "Toast",
            "role": "status",
            "content": { "text": "Saved" },
            "state": { "visible": true },
            "actions": [],
            "capture_limitations": [],
            "related_nodes": [],
            "extensions": {}
          }
        ]
      },
      "capture_limitations": [],
      "extensions": {}
    }
  ],
  "screenshot": {
    "object": {
      "hash": "sha256:0000000000000000000000000000000000000000000000000000000000000000",
      "media_type": "image/png",
      "byte_size": 1,
      "compression": "none",
      "extensions": {}
    },
    "capture_started_at": { "wall_time": "2026-07-12T00:02:01Z" },
    "capture_finished_at": { "wall_time": "2026-07-12T00:02:01.010Z" },
    "tree_skew_ms": 1,
    "coverage": { "x": 24, "y": 120, "width": 342, "height": 52 },
    "pixel_size": { "width": 1026, "height": 156 },
    "system_chrome": "excluded",
    "color_space": "srgb",
    "extensions": {}
  },
  "capabilities": { "names": ["runtime.snapshot"], "extensions": {} },
  "capture_limitations": [],
  "extensions": {}
}
