{
  "snapshot_id": "snapshot_019f0000-0000-7000-8000-000000000001",
  "protocol_version": { "major": 1, "minor": 0 },
  "captured_at": {
    "wall_time": "2026-07-12T00:00:00Z",
    "monotonic_offset_ns": 1000000
  },
  "runtime_context": {
    "project_id": "project_019f0000-0000-7000-8000-000000000001",
    "application_id": "dev.vistrea.demo",
    "build_id": "build_019f0000-0000-7000-8000-000000000001",
    "application_version": "1.0.0",
    "source_git_sha": "0123456789abcdef0123456789abcdef01234567",
    "platform": "ios",
    "device": {
      "kind": "simulator",
      "model": "Demo iPhone",
      "os_version": "18.0",
      "extensions": {}
    },
    "environment_id": "local",
    "locale": "en-US",
    "theme": "light",
    "text_scale": 1,
    "sdk_version": "0.1.0",
    "adapter_versions": { "uikit": "0.1.0" },
    "extensions": {}
  },
  "display": {
    "coordinate_unit": "logical_point",
    "origin": "top_left",
    "logical_size": { "width": 390, "height": 844 },
    "pixel_size": { "width": 1170, "height": 2532 },
    "pixel_scale_x": 3,
    "pixel_scale_y": 3,
    "orientation": "portrait",
    "safe_area": { "top": 59, "left": 0, "bottom": 34, "right": 0 },
    "geometry_revision": "display-1",
    "extensions": {}
  },
  "trees": [
    {
      "tree_id": "tree_019f0000-0000-7000-8000-000000000001",
      "kind": "semantic",
      "root_node_ids": ["node_019f0000-0000-7000-8000-000000000001"],
      "payload": {
        "inline_nodes": [
          {
            "node_id": "node_019f0000-0000-7000-8000-000000000001",
            "stable_id": "demo.home.root",
            "child_ids": [],
            "native_type": "UIView",
            "role": "container",
            "frame": { "x": 0, "y": 0, "width": 390, "height": 844 },
            "content": {},
            "state": { "visible": true, "enabled": true },
            "actions": [],
            "capture_limitations": [],
            "related_nodes": [],
            "extensions": {}
          }
        ]
      },
      "capture_limitations": [],
      "extensions": {}
    }
  ],
  "capabilities": {
    "names": ["runtime.snapshot"],
    "extensions": {}
  },
  "capture_limitations": [],
  "extensions": {}
}
